{"round":1,"snapshot_sha256":"8b11757363d14e2663ab5610066b98b8b0296707a58e7fc6222a72749d4cb060","reviewer_count":5,"consensus_strengths":["The strongest defensible contribution is the explicit formal separation of a finite-pool contrast conditional on one recorded decode realization from population-level or expected decoder behavior.","The manuscript consistently treats the cross-level mean commit-score-minus-correctness quantity as a descriptive directional statistic, not as validated answer-level calibration or a calibration certificate.","The natural-strata and fixed-filler analyses are correctly identified as having different samples and estimands, and the manuscript generally avoids causal, equivalence, transport, and cross-benchmark claims.","The displayed decompositions are internally arithmetically consistent: -0.0314-(-0.2541)=+0.2227 and -0.0875-(-0.0800)=-0.0075. This verifies transcription arithmetic only.","The paper is concise, anonymous, within the page limit, clearly organized, and unusually candid about its evidence limitations and AI assistance."],"consensus_weaknesses":["Every empirical value is source-reported and cannot be independently verified: the reviewer package lacks the item-level records, prompts, decode traces, labels, interval inputs, analysis code, and resolvable A32-E1–A32-E4 artifacts.","The literal filler, insertion rule, tokenizer-confirmed dose, item manifest, pairing, model/tokenizer revision, decoding configuration, and execution order are unavailable, so the claimed intervention cannot be reconstructed.","The commit-score extraction and token-to-item aggregation are undefined and unvalidated. Consequently, the cross-level statistic remains only an implementation-specific descriptive quantity, while the Brier/NLL labels lack established proper-scoring-rule semantics.","The -0.0075 filler estimate and separately estimated +0.2227 natural-strata gap permit only a descriptive juxtaposition of reported point magnitudes. They do not support a causal conclusion, a reproduction or non-reproduction claim, equivalence, or a joint inferential comparison.","The reported bootstrap brackets lack reviewer-accessible inputs, code, seeds, and a clearly specified uncertainty target; they also exclude decoder-run variation and therefore cannot characterize expected decoder behavior.","The headline question uses 'comparably large' and 'account operationally' without a prespecified margin, aligned sample, covariance-aware comparison, or decision rule.","The operation-specific novelty position is unresolved because the package itself acknowledges an incomplete prompt-length and masked-diffusion uncertainty literature search.","The paper's identity is unclear: it reads partly as an empirical paper and partly as an audit or transcription note, while its only independently checkable contribution is the estimand and evidence-boundary clarification."],"material_disagreements":[{"topic":"Soundness level of the present submission","positions":["The clarity and novelty reviewers assign Soundness 1 because no empirical finding is reviewer-verifiable.","The experimental, reproducibility, and technical reviewers assign Soundness 2 because the algebra, estimand definition, and interpretation boundaries are coherent despite unsupported empirical premises."],"recommended_resolution":"Credit the formal estimand and honest boundaries as locally sound, but treat the empirical contribution as unestablished. This distinction does not raise the holistic score above 2.","needs_adjudicator":false},{"topic":"Whether claim narrowing can resolve the headline comparability problem","positions":["One defensible route is to remove 'comparably large' and 'account operationally' language and present only an archival descriptive juxtaposition.","Retaining a diagnostic that answers comparability requires a common or justified aligned sample, a prespecified comparison functional or margin, and joint uncertainty."],"recommended_resolution":"Narrow the claim immediately using current evidence. Treat the aligned analysis as necessary only if the paper retains comparability or accounting as a central contribution; narrowing alone will not create an ICLR-level empirical contribution.","needs_adjudicator":false},{"topic":"Status of the Brier/NLL-labelled diagnostics","positions":["The manuscript's explicit disclaimer avoids the false claim that these are validated answer-level calibration measurements.","Reviewers nevertheless judge the undefined score construction, forecast event, and clipping rules to make even their scientific interpretation and reproduction impossible."],"recommended_resolution":"Preserve the disclaimer but either provide the complete score construction and implementations or remove the numerical diagnostics. Careful naming establishes honesty, not measurement validity.","needs_adjudicator":false},{"topic":"Priority of broader literature work","positions":["Novelty-focused reviews treat the incomplete prompt-length and masked-diffusion search as a high-impact barrier to contribution claims.","Technical and reproducibility reviews treat it as secondary to the absent empirical artifacts and undefined methods."],"recommended_resolution":"Resolve central evidence and method provenance first, then complete the literature audit before making an operation-specific novelty claim.","needs_adjudicator":false}],"unsupported_reviewer_claims":[{"reviewer_issue_id":"A32-R01-C-I6","reason":"The mismatch between three-decimal arm means and four-decimal contrasts does not demonstrate a numerical error; hidden-precision computation is plausible. Retain this only as a rounding-transparency and reviewer-accessibility issue."},{"reviewer_issue_id":"A32-R01-T-06","reason":"The displayed precision prevents exact reconstruction but does not establish that the underlying subtraction is wrong. The available four-decimal component changes are internally consistent with -0.0075."}],"meta_score":2,"meta_recommendation":"reject","evidence_ceiling":2,"prioritized_actions":[{"action_id":"A01","issue_ids":["A32-R01-C-I2","A32-R01-E-04","A32-R01-N-I3","A32-R01-R-I3","A32-R01-T-04"],"action_type":"claim_narrowing","description":"Remove claims that the current comparison determines whether filler is 'comparably large' or can 'account operationally' for the natural-strata gap. State that -0.0075 and +0.2227 are separately estimated, different-sample, different-estimand point values whose magnitude juxtaposition is descriptive only—not causal evidence, equivalence, reproduction, or non-reproduction.","expected_impact":"high","confidence":"high","cost":"low","dependencies":[],"verification_criterion":"The abstract, introduction, results, and conclusion contain no causal, equivalence, accounting, reproduction, or null-effect implication, and explicitly state that no joint comparison is available.","possible_with_current_evidence":true},{"action_id":"A02","issue_ids":["A32-R01-C-I1","A32-R01-E-01","A32-R01-E-02","A32-R01-N-I1","A32-R01-R-I1","A32-R01-R-I2","A32-R01-T-01","A32-R01-T-05"],"action_type":"experiment","description":"Recover or create the smallest immutable reviewer-safe bundle for the central natural-strata and paired-filler records: exact item manifests, exclusions, literal prompts and filler, insertion rule, tokenizer/model revisions, token-dose fixtures, paired outputs, traces, labels, configurations, logs, and executable table-generation code. This evidence is unavailable in the current package.","expected_impact":"high","confidence":"high","cost":"high","dependencies":[],"verification_criterion":"From a clean environment, every central evidence ID resolves to a hashed artifact and Tables 2–3, pair counts, decompositions, and brackets reproduce from item-level records without manually entering manuscript values.","possible_with_current_evidence":false},{"action_id":"A03","issue_ids":["A32-R01-C-I3","A32-R01-E-03","A32-R01-R-I4","A32-R01-T-02"],"action_type":"method","description":"Specify the executable mapping from token-level decode traces to each item-level commit score, including token scope, aggregation, weighting, range, timing, forecast event, answer matcher, and Brier/NLL formulas and clipping. Add construct validation if calibration significance is retained. Required traces and implementations are unavailable in the current package.","expected_impact":"high","confidence":"high","cost":"medium","dependencies":["A02"],"verification_criterion":"Independent code reproduces every item-level score and outcome from fixed traces, passes fixtures distinguishing plausible aggregation rules, and regenerates all retained score-based summaries.","possible_with_current_evidence":false},{"action_id":"A04","issue_ids":["A32-R01-E-05","A32-R01-N-I4","A32-R01-T-03"],"action_type":"analysis","description":"Define the uncertainty target, sampling frame, resampling unit, pairing rule, interval construction, seeds, and relationship to the conditional finite-pool estimand. If these cannot be recovered, remove confidence-interval language and present the brackets only as unvalidated source-reported numbers.","expected_impact":"high","confidence":"high","cost":"medium","dependencies":["A02"],"verification_criterion":"Each retained interval is reproducible from released rows and code and has an explicit target and conditioning set; otherwise the manuscript and evidence map consistently avoid CI or coverage claims.","possible_with_current_evidence":false},{"action_id":"A05","issue_ids":["A32-R01-C-I2","A32-R01-E-04","A32-R01-E-05","A32-R01-N-I3","A32-R01-R-I3","A32-R01-T-03","A32-R01-T-04"],"action_type":"experiment","description":"Only if comparability or expected decoder behavior remains central, run an aligned common-sample analysis with a prespecified comparison rule and covariance-aware uncertainty, plus deterministic replay or multiple paired decode realizations to estimate decoder-run variation. These results do not exist in the current package